{
  "schema_version": 1,
  "id": "sha256:4444444444444444444444444444444444444444444444444444444444444444",
  "source": { "kind": "trusted_ref", "ref_name": "refs/heads/main", "commit": "sha1:aaaaaaaaaaaaaaaaaaaaaaaaaaaaaaaaaaaaaaaa" },
  "rules_hash": "sha256:2222222222222222222222222222222222222222222222222222222222222222",
  "config_hash": "sha256:3333333333333333333333333333333333333333333333333333333333333333",
  "authorization_policy_version": 1,
  "created_at": "2026-10-23T00:00:00Z"
}
